{
  "schema_version": "3.0",
  "id": "IT-PIE-NO-RELYBYTES",
  "company": "RelyBytes S.r.l.",
  "website": "https://relybytes.com/",
  "country": "Italy",
  "location": {
    "region": "Piemonte",
    "city": "Arona",
    "address": "Via Vetta d'Italia 23, 28041 Arona (NO)"
  },
  "category": [
    "IT talent network",
    "freelance network",
    "WordPress",
    "CMS development",
    "external collaboration"
  ],
  "priority": "HOT",
  "scores": {
    "opportunity_score": 95,
    "outsourcing_score": 97,
    "vds_fit_score": 93,
    "revenue_potential_score": 92,
    "revenue_priority_score": 94
  },
  "contacts": {
    "emails": [],
    "phones": [],
    "people": [],
    "application_url": "https://relybytes.com/it/freelance"
  },
  "fit_reason": [
    "Freelance P.IVA and company partners explicitly accepted",
    "Full remote projects available, including professionals abroad",
    "E-commerce / CMS Developer role explicitly includes WordPress",
    "Per-project rate agreed before start, no marketplace bidding or exclusivity",
    "Client, contract and invoicing handled by RelyBytes"
  ],
  "evidence": [
    {
      "url": "https://relybytes.com/it/freelance",
      "verified_at": "2026-10-05T17:02:00Z",
      "published_at": null,
      "expires_at": null,
      "note": "Official RelyBytes freelance-network page; current application form, WordPress CMS role, remote modes and P.IVA/partner options verified."
    }
  ],
  "freshness": {
    "first_seen_at": "2026-10-05T17:00:00Z",
    "last_verified_at": "2026-10-05T17:02:00Z",
    "opportunity_published_at": null,
    "expires_at": null,
    "freshness_score": 100,
    "source_status": "CURRENT"
  },
  "economics": {
    "currency": "EUR",
    "estimated_value_low": null,
    "estimated_value_high": null,
    "probability_pct": null,
    "weighted_value": null,
    "recurring_potential": "HIGH",
    "estimate_confidence": "NONE",
    "notes": "No amount published; rate is agreed per project and payment terms are 30 days end-of-month."
  },
  "suppression_state": "CLEAR",
  "opportunities": [
    "OPP-IT-RELYBYTES-FREELANCE-CMS-WORDPRESS-NETWORK-2026"
  ],
  "campaign_ids": [
    "VDS-JOB-FLOW-2026"
  ],
  "status": "READY_TO_CONTACT",
  "outreach": [],
  "timeline": [],
  "next_action": {
    "action": "MANUAL_APPLY_FORM",
    "reason": "Official route requires CV upload and privacy consent; no authoritative application email is provided.",
    "due_at": null,
    "owner": "USER",
    "priority": "HIGH",
    "expected_commercial_impact": "VERY_HIGH",
    "confidence": "HIGH"
  },
  "notes": [
    "Required materials: CV (PDF or Word, max 20 MB), primary role; LinkedIn/portfolio optional; collaboration mode and work location can be specified.",
    "Material gap: no specific live client project for WordPress is exposed; this is admission to the talent network."
  ],
  "last_verified_at": "2026-10-05T17:02:00Z"
}
