{"schema_version":"3.0","id":"IT-TOS-FI-NEXIBO","company":"Nexìbo","website":"https://nexibo.agency/","country":"Italy","location":{"region":"Toscana","city":"Scandicci (Firenze)","address":"Via Alessandro Manzoni 14, Scandicci (FI)"},"category":["digital-agency","ux-ui","web-development","freelance-network"],"priority":"HOT","scores":{"opportunity_score":97,"outsourcing_score":100,"vds_fit_score":98,"revenue_potential_score":94,"revenue_priority_score":97},"contacts":{"emails":["collab@nexibo.agency","info@nexibo.agency"],"phones":["+39 0552698131"],"people":[],"application_url":"https://nexibo.agency/contatti"},"fit_reason":["Agency explicitly says it is formed by freelance collaborators.","Invites external collaborators with CV and best works.","UX/UI, websites, SEO and performance match VDS."],"evidence":[{"url":"https://nexibo.agency/contatti","verified_at":"2026-08-28","published_at":null,"expires_at":null,"note":"Explicit external collaborator invitation and collaboration mailbox."}],"freshness":{"first_seen_at":"2026-08-28","last_verified_at":"2026-08-28","opportunity_published_at":null,"expires_at":null,"freshness_score":95,"source_status":"EVERGREEN"},"economics":{"currency":"EUR","estimated_value_low":null,"estimated_value_high":null,"probability_pct":null,"weighted_value":null,"recurring_potential":"HIGH","estimate_confidence":"NONE","notes":"No verified budget."},"opportunities":["OPP-IT-NEXIBO-COLLAB"],"campaign_ids":["AGENCY-OUTSOURCING-IT"],"status":"READY_TO_CONTACT","outreach":[],"timeline":[{"event_id":"IT-TOS-FI-NEXIBO-EV001","timestamp":"2026-08-28T13:10:00+02:00","type":"QUALIFIED","channel":"web","actor":"AUTOMATION","previous_status":"RESEARCH","new_status":"READY_TO_CONTACT","outcome":"Qualified explicit external collaborator network.","evidence":"https://nexibo.agency/contatti"}],"next_action":{"action":"REVIEW_COLLABORATION_ROUTE","reason":"Explicit external collaborator network with strong VDS fit.","due_at":null,"owner":"AUTOMATION","priority":"HIGH","expected_commercial_impact":"HIGH","confidence":"HIGH"},"notes":["Migrated from CRM v2 and normalized to CRM v3 during repository separation."],"last_verified_at":"2026-08-28"}